{
  "ir_version": "cubeengine.input-ir/2.0-alpha.1",
  "document_id": "input:game.snake.game.with.python.and.pygame.target",
  "revision": 1,
  "content_hash": "1acea5bccad7917c482c773d46558b941ff5919df49cb46517c9a9e42bdb2329",
  "metadata": {
    "title": "Step Snake Input",
    "description": "",
    "source_project_hash": ""
  },
  "dependencies": {
    "rule_ir": {
      "document_id": "rule:game.snake.game.with.python.and.pygame.target",
      "content_hash": "7678bc300532bfc439a9b4f06131170e6c737282534ea8b77cedc612a1825f0f"
    },
    "extensions": []
  },
  "contexts": [
    {
      "id": "input:context.play",
      "name": "Play",
      "priority": 100,
      "enabled_by_default": true,
      "focus": "viewport",
      "consume_policy": "first_match",
      "exclusive_group": "runtime_mode"
    }
  ],
  "intents": [
    {
      "id": "input:action.intent.move.up",
      "name": "Move Up",
      "value_type": "digital",
      "required": true,
      "target": {
        "kind": "rule_action",
        "action": "rule:action.move_up",
        "parameters": {}
      }
    },
    {
      "id": "input:action.intent.move.down",
      "name": "Move Down",
      "value_type": "digital",
      "required": true,
      "target": {
        "kind": "rule_action",
        "action": "rule:action.move_down",
        "parameters": {}
      }
    },
    {
      "id": "input:action.intent.move.left",
      "name": "Move Left",
      "value_type": "digital",
      "required": true,
      "target": {
        "kind": "rule_action",
        "action": "rule:action.move_left",
        "parameters": {}
      }
    },
    {
      "id": "input:action.intent.move.right",
      "name": "Move Right",
      "value_type": "digital",
      "required": true,
      "target": {
        "kind": "rule_action",
        "action": "rule:action.move_right",
        "parameters": {}
      }
    },
    {
      "id": "input:action.intent.move.z_up",
      "name": "Move Z Up",
      "value_type": "digital",
      "required": true,
      "target": {
        "kind": "rule_action",
        "action": "rule:action.move_z_up",
        "parameters": {}
      }
    },
    {
      "id": "input:action.intent.move.z_down",
      "name": "Move Z Down",
      "value_type": "digital",
      "required": true,
      "target": {
        "kind": "rule_action",
        "action": "rule:action.move_z_down",
        "parameters": {}
      }
    }
  ],
  "bindings": [
    {
      "id": "input:binding.up",
      "name": "Up",
      "context": "input:context.play",
      "intent": "input:action.intent.move.up",
      "priority": 100,
      "enabled": true,
      "consume": true,
      "rebindable": true,
      "slot": "primary",
      "accessibility_label": "Up",
      "trigger": {
        "kind": "control",
        "device": "keyboard",
        "control": "keyboard.key.arrow_up",
        "phase": "press",
        "modifiers": [],
        "modifier_policy": "exact"
      },
      "processing": {
        "dead_zone": 0,
        "sensitivity_numerator": 1,
        "sensitivity_denominator": 1,
        "invert": false,
        "clamp_min": -32768,
        "clamp_max": 32767
      }
    },
    {
      "id": "input:binding.down",
      "name": "Down",
      "context": "input:context.play",
      "intent": "input:action.intent.move.down",
      "priority": 100,
      "enabled": true,
      "consume": true,
      "rebindable": true,
      "slot": "primary",
      "accessibility_label": "Down",
      "trigger": {
        "kind": "control",
        "device": "keyboard",
        "control": "keyboard.key.arrow_down",
        "phase": "press",
        "modifiers": [],
        "modifier_policy": "exact"
      },
      "processing": {
        "dead_zone": 0,
        "sensitivity_numerator": 1,
        "sensitivity_denominator": 1,
        "invert": false,
        "clamp_min": -32768,
        "clamp_max": 32767
      }
    },
    {
      "id": "input:binding.left",
      "name": "Left",
      "context": "input:context.play",
      "intent": "input:action.intent.move.left",
      "priority": 100,
      "enabled": true,
      "consume": true,
      "rebindable": true,
      "slot": "primary",
      "accessibility_label": "Left",
      "trigger": {
        "kind": "control",
        "device": "keyboard",
        "control": "keyboard.key.arrow_left",
        "phase": "press",
        "modifiers": [],
        "modifier_policy": "exact"
      },
      "processing": {
        "dead_zone": 0,
        "sensitivity_numerator": 1,
        "sensitivity_denominator": 1,
        "invert": false,
        "clamp_min": -32768,
        "clamp_max": 32767
      }
    },
    {
      "id": "input:binding.right",
      "name": "Right",
      "context": "input:context.play",
      "intent": "input:action.intent.move.right",
      "priority": 100,
      "enabled": true,
      "consume": true,
      "rebindable": true,
      "slot": "primary",
      "accessibility_label": "Right",
      "trigger": {
        "kind": "control",
        "device": "keyboard",
        "control": "keyboard.key.arrow_right",
        "phase": "press",
        "modifiers": [],
        "modifier_policy": "exact"
      },
      "processing": {
        "dead_zone": 0,
        "sensitivity_numerator": 1,
        "sensitivity_denominator": 1,
        "invert": false,
        "clamp_min": -32768,
        "clamp_max": 32767
      }
    },
    {
      "id": "input:binding.z_up",
      "name": "Z Up",
      "context": "input:context.play",
      "intent": "input:action.intent.move.z_up",
      "priority": 100,
      "enabled": true,
      "consume": true,
      "rebindable": true,
      "slot": "primary",
      "accessibility_label": "Z Up",
      "trigger": {
        "kind": "control",
        "device": "keyboard",
        "control": "keyboard.key.page_up",
        "phase": "press",
        "modifiers": [],
        "modifier_policy": "exact"
      },
      "processing": {
        "dead_zone": 0,
        "sensitivity_numerator": 1,
        "sensitivity_denominator": 1,
        "invert": false,
        "clamp_min": -32768,
        "clamp_max": 32767
      }
    },
    {
      "id": "input:binding.z_down",
      "name": "Z Down",
      "context": "input:context.play",
      "intent": "input:action.intent.move.z_down",
      "priority": 100,
      "enabled": true,
      "consume": true,
      "rebindable": true,
      "slot": "primary",
      "accessibility_label": "Z Down",
      "trigger": {
        "kind": "control",
        "device": "keyboard",
        "control": "keyboard.key.page_down",
        "phase": "press",
        "modifiers": [],
        "modifier_policy": "exact"
      },
      "processing": {
        "dead_zone": 0,
        "sensitivity_numerator": 1,
        "sensitivity_denominator": 1,
        "invert": false,
        "clamp_min": -32768,
        "clamp_max": 32767
      }
    }
  ],
  "provenance": {},
  "unresolved": []
}
