{
  "ir_version": "cubeengine.input-ir/2.0-alpha.1",
  "document_id": "input:game.snake.game.with.python.and.pygame.source",
  "revision": 1,
  "content_hash": "5e29d7df2ece39374db0f1219fab836d15d5deca3cc7c68108ecc97c5687f304",
  "metadata": {
    "title": "Snake Game with Python and Pygame",
    "description": "LLM compiler bootstrap shell. Semantics must be filled by evidence-backed patches.",
    "source_project_hash": "fb4489a2a7ea119934c40fd9c809fb7a7c74bfbe9470adea0162f39ffc53f35e"
  },
  "dependencies": {
    "rule_ir": {
      "document_id": "rule:game.snake.game.with.python.and.pygame.source",
      "content_hash": "679750ba075ccc96c45a80118e06dfd6217b8e77f399b6cf3c3f00e6dcb49f6b"
    },
    "extensions": []
  },
  "contexts": [
    {
      "id": "input:context.play",
      "name": "Play",
      "priority": 100,
      "enabled_by_default": true,
      "focus": "viewport",
      "consume_policy": "first_match",
      "exclusive_group": "runtime_mode"
    }
  ],
  "intents": [
    {
      "id": "input:action.intent.move.up",
      "name": "Move Up",
      "value_type": "digital",
      "required": true,
      "target": {
        "kind": "rule_action",
        "action": "rule:action.move_up",
        "parameters": {}
      }
    },
    {
      "id": "input:action.intent.move.down",
      "name": "Move Down",
      "value_type": "digital",
      "required": true,
      "target": {
        "kind": "rule_action",
        "action": "rule:action.move_down",
        "parameters": {}
      }
    },
    {
      "id": "input:action.intent.move.left",
      "name": "Move Left",
      "value_type": "digital",
      "required": true,
      "target": {
        "kind": "rule_action",
        "action": "rule:action.move_left",
        "parameters": {}
      }
    },
    {
      "id": "input:action.intent.move.right",
      "name": "Move Right",
      "value_type": "digital",
      "required": true,
      "target": {
        "kind": "rule_action",
        "action": "rule:action.move_right",
        "parameters": {}
      }
    }
  ],
  "bindings": [
    {
      "id": "input:binding.up",
      "name": "Up",
      "context": "input:context.play",
      "intent": "input:action.intent.move.up",
      "priority": 100,
      "enabled": true,
      "consume": true,
      "rebindable": true,
      "slot": "primary",
      "accessibility_label": "Up",
      "trigger": {
        "kind": "control",
        "device": "keyboard",
        "control": "keyboard.key.arrow_up",
        "phase": "press",
        "modifiers": [],
        "modifier_policy": "exact"
      },
      "processing": {
        "dead_zone": 0,
        "sensitivity_numerator": 1,
        "sensitivity_denominator": 1,
        "invert": false,
        "clamp_min": -32768,
        "clamp_max": 32767
      }
    },
    {
      "id": "input:binding.down",
      "name": "Down",
      "context": "input:context.play",
      "intent": "input:action.intent.move.down",
      "priority": 100,
      "enabled": true,
      "consume": true,
      "rebindable": true,
      "slot": "primary",
      "accessibility_label": "Down",
      "trigger": {
        "kind": "control",
        "device": "keyboard",
        "control": "keyboard.key.arrow_down",
        "phase": "press",
        "modifiers": [],
        "modifier_policy": "exact"
      },
      "processing": {
        "dead_zone": 0,
        "sensitivity_numerator": 1,
        "sensitivity_denominator": 1,
        "invert": false,
        "clamp_min": -32768,
        "clamp_max": 32767
      }
    },
    {
      "id": "input:binding.left",
      "name": "Left",
      "context": "input:context.play",
      "intent": "input:action.intent.move.left",
      "priority": 100,
      "enabled": true,
      "consume": true,
      "rebindable": true,
      "slot": "primary",
      "accessibility_label": "Left",
      "trigger": {
        "kind": "control",
        "device": "keyboard",
        "control": "keyboard.key.arrow_left",
        "phase": "press",
        "modifiers": [],
        "modifier_policy": "exact"
      },
      "processing": {
        "dead_zone": 0,
        "sensitivity_numerator": 1,
        "sensitivity_denominator": 1,
        "invert": false,
        "clamp_min": -32768,
        "clamp_max": 32767
      }
    },
    {
      "id": "input:binding.right",
      "name": "Right",
      "context": "input:context.play",
      "intent": "input:action.intent.move.right",
      "priority": 100,
      "enabled": true,
      "consume": true,
      "rebindable": true,
      "slot": "primary",
      "accessibility_label": "Right",
      "trigger": {
        "kind": "control",
        "device": "keyboard",
        "control": "keyboard.key.arrow_right",
        "phase": "press",
        "modifiers": [],
        "modifier_policy": "exact"
      },
      "processing": {
        "dead_zone": 0,
        "sensitivity_numerator": 1,
        "sensitivity_denominator": 1,
        "invert": false,
        "clamp_min": -32768,
        "clamp_max": 32767
      }
    }
  ],
  "provenance": {
    "patch_history": [
      {
        "base_revision": 0,
        "base_content_hash": "d9f5b3de56327f8d42d60cd0c2a8f724c71d05dc832d492dda761607aa06a762",
        "evidence": [
          {
            "evidence_id": "ev:input.0",
            "path": "snake.py",
            "kind": "static",
            "supports": "/input_ir/bindings",
            "confidence": 0.8,
            "file_sha256": "085015d8aaa06f484df9ce0361fa4438981aecd8e1dc14ea0ba3ba744583b7dd",
            "span": {
              "line_start": 288,
              "line_end": 288
            }
          }
        ],
        "assumptions": [],
        "operation_count": 4
      }
    ]
  },
  "unresolved": []
}
